<?xml version="1.0" encoding="UTF-8" ?>

<scenario description="RYSCA: Escenario simple con 2 PCs (Ãºtil para pruebas de desarrollo con librawnet)"
xmlns:xsi="http://www.w3.org/2001/XMLSchema-instance"
xsi:noNamespaceSchemaLocation="lightning-xml-schema.xsd">

  <container name="hostX" type="host">
    <interface name="eth1" enable_ipv6="yes" link_local_ipv6="no"/>
  </container>
  
  <container name="hostY" type="host">
    <interface name="eth1" enable_ipv6="yes" link_local_ipv6="no"/>
  </container>
  
  
  <network name="Red1" type="switch">
    
    <container name="hostX">
      <interface name="eth1">
        <ip>192.100.100.101/24</ip>
      </interface>
    </container>
    
    <container name="hostY">
      <interface name="eth1">
        <ip>192.100.100.102/24</ip>
      </interface>
    </container>
    
  </network>
  
  
</scenario>
