<?xml version="1.0" encoding="UTF-8" ?>

<scenario description="RSC: Escenario 2 práctica sesión 16"
xmlns:xsi="http://www.w3.org/2001/XMLSchema-instance"
xsi:noNamespaceSchemaLocation="lightning-xml-schema.xsd">

  <container name="PCA1" type="host">
    <interface name="eth1" enable_ipv6="yes" link_local_ipv6="no"/>
  </container>
  
  <container name="PCB1" type="host">
    <interface name="eth1" enable_ipv6="yes" link_local_ipv6="no"/>
  </container>
  
  <container name="PCA2" type="host">
    <interface name="eth1" enable_ipv6="yes" link_local_ipv6="no"/>
  </container>
  
  <container name="PCB2" type="host">
    <interface name="eth1" enable_ipv6="yes" link_local_ipv6="no"/>
  </container>
  
  <container name="RA1" type="router">
    <interface name="eth0.0" enable_ipv6="yes">
      <default_ip>192.168.0.1/24</default_ip>
    </interface>
    <interface name="eth0.1" enable_ipv6="yes" link_local_ipv6="no">
      <default_ip>192.168.1.1/24</default_ip>
    </interface>
    <interface name="eth0.2" enable_ipv6="yes" link_local_ipv6="no">
      <default_ip>192.168.2.1/24</default_ip>
    </interface>
    <interface name="eth0.3" enable_ipv6="yes" link_local_ipv6="no">
      <default_ip>192.168.3.1/24</default_ip>
    </interface>
    <interface name="eth0.4" enable_ipv6="yes" link_local_ipv6="no">
      <default_ip>192.168.4.1/24</default_ip>
    </interface>
    <interface name="wlan0" enable_ipv6="yes" link_local_ipv6="no">
      <default_ip>192.168.5.1/24</default_ip>
    </interface>
  </container>
  
  <container name="RB1" type="router">
    <interface name="eth0.0" enable_ipv6="yes">
      <default_ip>192.168.0.1/24</default_ip>
    </interface>
    <interface name="eth0.1" enable_ipv6="yes" link_local_ipv6="no">
      <default_ip>192.168.1.1/24</default_ip>
    </interface>
    <interface name="eth0.2" enable_ipv6="yes" link_local_ipv6="no">
      <default_ip>192.168.2.1/24</default_ip>
    </interface>
    <interface name="eth0.3" enable_ipv6="yes" link_local_ipv6="no">
      <default_ip>192.168.3.1/24</default_ip>
    </interface>
    <interface name="eth0.4" enable_ipv6="yes" link_local_ipv6="no">
      <default_ip>192.168.4.1/24</default_ip>
    </interface>
    <interface name="wlan0" enable_ipv6="yes" link_local_ipv6="no">
      <default_ip>192.168.5.1/24</default_ip>
    </interface>
  </container>
  
  <container name="RA2" type="router">
    <interface name="eth0.0" enable_ipv6="yes">
      <default_ip>192.168.0.1/24</default_ip>
    </interface>
    <interface name="eth0.1" enable_ipv6="yes" link_local_ipv6="no">
      <default_ip>192.168.1.1/24</default_ip>
    </interface>
    <interface name="eth0.2" enable_ipv6="yes" link_local_ipv6="no">
      <default_ip>192.168.2.1/24</default_ip>
    </interface>
    <interface name="eth0.3" enable_ipv6="yes" link_local_ipv6="no">
      <default_ip>192.168.3.1/24</default_ip>
    </interface>
    <interface name="eth0.4" enable_ipv6="yes" link_local_ipv6="no">
      <default_ip>192.168.4.1/24</default_ip>
    </interface>
    <interface name="wlan0" enable_ipv6="yes" link_local_ipv6="no">
      <default_ip>192.168.5.1/24</default_ip>
    </interface>
  </container>
  
  <container name="RB2" type="router">
    <interface name="eth0.0" enable_ipv6="yes">
      <default_ip>192.168.0.1/24</default_ip>
    </interface>
    <interface name="eth0.1" enable_ipv6="yes" link_local_ipv6="no">
      <default_ip>192.168.1.1/24</default_ip>
    </interface>
    <interface name="eth0.2" enable_ipv6="yes" link_local_ipv6="no">
      <default_ip>192.168.2.1/24</default_ip>
    </interface>
    <interface name="eth0.3" enable_ipv6="yes" link_local_ipv6="no">
      <default_ip>192.168.3.1/24</default_ip>
    </interface>
    <interface name="eth0.4" enable_ipv6="yes" link_local_ipv6="no">
      <default_ip>192.168.4.1/24</default_ip>
    </interface>
    <interface name="wlan0" enable_ipv6="yes" link_local_ipv6="no">
      <default_ip>192.168.5.1/24</default_ip>
    </interface>
  </container>
  
  
  <network name="RedA1" type="switch">
    
    <container name="PCA1">
      <interface name="eth1">
        <ip>192.100.100.101/24</ip>
      </interface>
    </container>
    
    <container name="RA1">
      <interface name="eth0.0"/>
    </container>
    
  </network>
  
  
  <network name="RedB1" type="switch">
    
    <container name="PCB1">
      <interface name="eth1">
        <ip>192.100.100.102/24</ip>
      </interface>
    </container>
    
    <container name="RB1">
      <interface name="eth0.0"/>
    </container>
    
  </network>
  
  
  <network name="RedA1B1" type="switch">
    
    <container name="RA1">
      <interface name="eth0.1"/>
    </container>
    
    <container name="RB1">
      <interface name="eth0.1"/>
    </container>
    
  </network>
  
  
  <network name="RedA1A2" type="switch">
    
    <container name="RA1">
      <interface name="eth0.2"/>
    </container>
    
    <container name="RA2">
      <interface name="eth0.2"/>
    </container>
    
  </network>
  
  
  <network name="RedB1B2" type="switch">
    
    <container name="RB1">
      <interface name="eth0.2"/>
    </container>
    
    <container name="RB2">
      <interface name="eth0.2"/>
    </container>
    
  </network>
  

  <network name="RedA2B2" type="switch">
    
    <container name="RA2">
      <interface name="eth0.1"/>
    </container>
    
    <container name="RB2">
      <interface name="eth0.1"/>
    </container>
    
  </network>
  
  
  <network name="RedA2" type="switch">
    
    <container name="PCA2">
      <interface name="eth1">
        <ip>192.100.100.103/24</ip>
      </interface>
    </container>
    
    <container name="RA2">
      <interface name="eth0.0"/>
    </container>
    
  </network>
  
  
  <network name="RedB2" type="switch">
    
    <container name="PCB2">
      <interface name="eth1">
        <ip>192.100.100.104/24</ip>
      </interface>
    </container>
    
    <container name="RB2">
      <interface name="eth0.0"/>
    </container>
    
  </network>
  
</scenario>
